Movie Title,Unnamed: 0,Movie URL,Synopsis
Big Eyes,47,https://imsdb.com/Movie Scripts/Big Eyes Script.html,"In San Francisco in the 1950s, Margaret was a woman trying to make it on her own after leaving her husband with only her daughter and her paintings. While struggling to make an impact with her drawings of children with big eyes, she meets gregarious ladies' man and fellow painter Walter Keane in a park. The two quickly become a pair with outgoing Walter selling their paintings and quiet Margaret holed up at home painting even more children with big eyes, but Walter's actually selling her paintings as his own. A clash of financial success and critical failure soon sends Margaret reeling in her life of lies. With Walter still living the high life, Margaret's going to have to try making it on her own again and reclaiming her name and her paintings."
Big Fish,48,https://imsdb.com/Movie Scripts/Big Fish Script.html,"United Press International journalist Will Bloom and his French freelance photojournalist wife Josephine Bloom, who is pregnant with their first child, leave their Paris base to return to Will's hometown of Ashton, Alabama on the news that his father, Edward Bloom, stricken with cancer, will soon die, he being taken off chemotherapy treatment. Although connected indirectly through Will's mother/Edward's wife, Sandra Bloom, Will has been estranged from his father for three years since his and Josephine's wedding. Will's issue with his father is the fanciful tales Edward has told of his life all his life, not only to Will but the whole world. As a child when Edward was largely absent as a traveling salesman, Will believed those stories, but now realizes that he does not know his father, who, as he continues to tell these stories, he will never get to know unless Edward comes clean with the truth before he dies. On the brink of his own family life beginning, Will does not want to be the kind of father Edward has been to him. One of those stories from Edward's childhood - that he saw his own death in the glass eye of a witch - led to him embracing life since he would not have to fear death knowing when and how it would eventually come. The question is whether Will will be able to reconcile Edward's stories against his real life, either directly from Edward before he dies and/or from other sources, and thus allow Will to come to a new understanding of himself and his life, past, present and future."
"Big Lebowski, The",49,"https://imsdb.com/Movie Scripts/Big Lebowski, The Script.html","When ""the dude"" Lebowski is mistaken for a millionaire Lebowski, two thugs urinate on his rug to coerce him into paying a debt he knows nothing about. While attempting to gain recompense for the ruined rug from his wealthy counterpart, he accepts a one-time job with high pay-off. He enlists the help of his bowling buddy, Walter, a gun-toting Jewish-convert with anger issues. Deception leads to more trouble, and it soon seems that everyone from porn empire tycoons to nihilists want something from The Dude."
"Big Sick, The",50,"https://imsdb.com/Movie Scripts/Big Sick, The Script.html","Kumail (Kumail Nanjiani), in the middle of becoming a budding stand-up comedian, meets Emily (Zoe Kazan). Meanwhile, a sudden illness sets in forcing Emily to be put into a medically-induced coma. Kumail must navigate being a comedian, dealing with tragic illness, and placating his family's desire to let them fix him up with a spouse, while contemplating and figuring out who he really is and what he truly believes."
"Big White, The",51,"https://imsdb.com/Movie Scripts/Big White, The Script.html","In the middle of Alaska, travel agent Paul Barnell is near bankruptcy. Desperate to help himself and his beloved, mentally ill wife Margaret, Paul discovers a dead body and passes it off as his missing brother Raymond, whose life is insured for up to $1,000,000. Everybody is duped, except for workaholic insurance investigator Ted Waters, who sets out to expose Paul, in hopes of being promoted out of Alaska. Meanwhile, two rookie hit men, Gary and Jimbo, discover Paul took 'their' body and kidnap Margaret, demanding the body back. Then, Raymond turns up alive, wanting in on the action..."
Birdman,52,https://imsdb.com/Movie Scripts/Birdman Script.html,"Actor Riggan Thomson is most famous for his movie role from over twenty years ago of the comic book superhero Birdman in the blockbuster movie of the same name and its two equally popular sequels. His association with the role took over his life, where Birdman is more renowned than ""Riggan Thomson"" the actor. Now past middle age, Riggan is trying to establish himself as a true artist by writing, directing, starring in and co-producing with his best friend Jake what is his Broadway debut, an adaptation of Raymond Carver's story, What We Talk About When We Talk About Love. He is staking his name, what little artistic reputation that comes with that name and his life savings on the project, and as such will do anything needed to make the play a success. As he and Jake go through the process of the previews toward opening night, Riggan runs into several issues: needing to find a replacement for the integral supporting male role the night before the first preview; hiring the talented Broadway name, Mike Shiner, for that role, Mike who ends up being difficult to work with and who may end up overshadowing Riggan in the play; having to deal potentially with a lawsuit based on one of his actions to ensure success; needing to be there for his daughter, Sam, who he has hired to be his production assistant and who has just come out of drug rehab; and pleasing the New York Times critic, Tabitha Dickinson, who wants to use any excuse to give the play a scathing review which in turn would close the show after the opening night performance. But Riggan's biggest problem may be his own insecurities, which are manifested by him constantly hearing what he believes to be the truth from the voice of his Birdman character, who he often battles both internally and externally."
"Birds, The",53,"https://imsdb.com/Movie Scripts/Birds, The Script.html","Melanie Daniels is the modern rich socialite, part of the jet-set who always gets what she wants. When lawyer Mitch Brenner sees her in a pet shop, he plays something of a practical joke on her, and she decides to return the favor. She drives about an hour north of San Francisco to Bodega Bay, where Mitch spends the weekends with his mother Lydia and younger sister Cathy. Soon after her arrival, however, the birds in the area begin to act strangely. A seagull attacks Melanie as she is crossing the bay in a small boat, and then, Lydia finds her neighbor dead, obviously the victim of a bird attack. Soon, birds in the hundreds and thousands are attacking anyone they find out of doors. There is no explanation as to why this might be happening, and as the birds continue their vicious attacks, survival becomes the priority."
Birthday Girl,54,https://imsdb.com/Movie Scripts/Birthday Girl Script.html,"Internet love connections and mail-order brides rarely ever work out, and John should have known. Having never been lucky in the game of love and tired of waiting for the perfect woman to come along, John decides to take his chances and orders a mail-order bride from Russia online. At first, things seem perfect: his new bride Nadia is a gorgeous woman, and although she may not speak much English, her skills in the bedroom more than make up for any communication problems. When Nadia's 'cousins' unexpectedly arrive to celebrate her birthday, John is drawn into their web of corruption and crime."
"Black Dahlia, The",55,"https://imsdb.com/Movie Scripts/Black Dahlia, The Script.html","In 1946, the former boxers Dwight ""Bucky"" Bleichert and Lee Blanchard are policemen in Los Angeles. Lee has a good relationship with his chief and uses a box fight between them to promote the department and get a raise to the police force. They succeed and are promoted to homicide detectives, working together. Bucky becomes a close friend of Lee and his girlfriend Kay Lake, forming a triangle of love. When the corpse of the aspirant actress Elizabeth Short is found mutilated, Lee becomes obsessed to solve the case called by the press Black Dahlia. Meanwhile, Bucky's investigation leads him to a Madeleine Linscott, the daughter of a powerful and wealthy constructor that resembles the Black Dahlia. In an environment of corruption and lies, Bucky discloses hidden truths."
Black Panther,56,https://imsdb.com/Movie Scripts/Black Panther Script.html,"After the events of Captain America: Civil War, Prince T'Challa returns home to the reclusive, technologically advanced African nation of Wakanda to serve as his country's new king. However, T'Challa soon finds that he is challenged for the throne from factions within his own country. When two foes conspire to destroy Wakanda, the hero known as Black Panther must team up with C.I.A. agent Everett K. Ross and members of the Dora Milaje, Wakandan special forces, to prevent Wakanda from being dragged into a world war."
Black Rain,57,https://imsdb.com/Movie Scripts/Black Rain Script.html,"Two New York cops get involved in a gang war between members of the Yakuza, the Japanese Mafia. They arrest one of their killers and are ordered to escort him back to Japan. In Japan, however, he manages to escape. As they try to track him down, they get deeper and deeper into the Japanese Mafia scene and they have to learn that they can only win by playing the game the Japanese way."
Black Snake Moan,58,https://imsdb.com/Movie Scripts/Black Snake Moan Script.html,"In rural Tennessee, Lazarus, a former blues musician who survives by truck farming, finds a young girl nearly beaten to death near his home. She's the white-trash town tramp, molded by a life of sexual abuse at the hands of her father and verbal abuse from her mother, who seems to delight in reminding Rae of her mistake in not aborting her. Lazarus, who is also facing personal crisis at the dissolution of his marriage, nurses Rae back to health, providing her with gentle, fatherly advice as well as an education in blues music. Rae's boyfriend, Ronnie, goaded by the man who nearly beat Rae to death, misunderstands the relationship between Lazarus and Rae, and vows to kill him. Lazarus, exhibiting a street-smart understanding of violence and its motives, calls Ronnie's bluff, senses that he is as troubled as Rae, and becomes a guiding force in the young couple's resurrection."
Black Swan,59,https://imsdb.com/Movie Scripts/Black Swan Script.html,"Nina (Portman) is a ballerina in a New York City ballet company whose life, like all those in her profession, is completely consumed with dance. She lives with her obsessive former ballerina mother Erica (Hershey) who exerts a suffocating control over her. When artistic director Thomas Leroy (Cassel) decides to replace prima ballerina Beth MacIntyre (Ryder) for the opening production of their new season, Swan Lake, Nina is his first choice. But Nina has competition: a new dancer, Lily (Kunis), who impresses Leroy as well. Swan Lake requires a dancer who can play both the White Swan with innocence and grace, and the Black Swan, who represents guile and sensuality. Nina fits the White Swan role perfectly but Lily is the personification of the Black Swan. As the two young dancers expand their rivalry into a twisted friendship, Nina begins to get more in touch with her dark side - a recklessness that threatens to destroy her."
BlacKkKlansman,60,https://imsdb.com/Movie Scripts/BlacKkKlansman Script.html,"In the early 1970s, Ron Stallworth is hired as the first Black officer in the Colorado Springs, Colorado Police Department. Stallworth is initially assigned to work in the records room, where he faces racial slurs from his coworkers. Stallworth requests a transfer to go undercover, and is assigned to infiltrate a local rally at which national civil rights leader Kwame Ture (birth name Stokely Carmichael) is to give a speech. At the rally, Stallworth meets Patrice Dumas, the president of the black student union at Colorado College. While taking Ture to his hotel, Patrice is stopped by patrolman Andy Landers, a corrupt, racist officer in Stallworth's precinct, who threatens Ture and sexually assaults Patrice."
Blade,61,https://imsdb.com/Movie Scripts/Blade Script.html,"Thirty years after the events of Blade Runner (1982), a new Blade Runner, L.A.P.D. Officer ""K"" (Ryan Gosling), unearths a long-buried secret that has the potential to plunge what's left of society into chaos. K's discovery leads him on a quest to find Rick Deckard (Harrison Ford), a former L.A.P.D. Blade Runner, who has been missing for thirty years."
Blade II,62,https://imsdb.com/Movie Scripts/Blade II Script.html,"A rare mutation has occurred within the vampire community. The Reaper. A vampire so consumed with an insatiable bloodlust that they prey on vampires as well as humans, transforming victims who are unlucky enough to survive into Reapers themselves. Now their quickly expanding population threatens the existence of vampires, and soon there won't be enough humans in the world to satisfy their bloodlust. Blade, Whistler and an armory expert named Scud are curiously summoned by the Shadow Council. The council reluctantly admits that they are in a dire situation and they require Blade's assistance. Blade then tenuously enters into an alliance with The Bloodpack, an elite team of vampires trained in all modes of combat to defeat the Reaper threat. Blade's team and the Bloodpack are the only line of defense which can prevent the Reaper population from wiping out the vampire and human populations."
Blade Runner,63,https://imsdb.com/Movie Scripts/Blade Runner Script.html,"Thirty years after the events of Blade Runner (1982), a new Blade Runner, L.A.P.D. Officer ""K"" (Ryan Gosling), unearths a long-buried secret that has the potential to plunge what's left of society into chaos. K's discovery leads him on a quest to find Rick Deckard (Harrison Ford), a former L.A.P.D. Blade Runner, who has been missing for thirty years."
Blade: Trinity,64,https://imsdb.com/Movie Scripts/Blade: Trinity Script.html,"Blade finds himself alone surrounded by enemies, fighting an up hill battle with the vampire nation and now humans. He joins forces with a group of vampire hunters who call themselves the Nightstalkers. The vampire nation awakens the king of vampires Dracula from his slumber with intentions of using his primitive blood to become day-walkers. On the other side is Blade and his team manifesting a virus that could wipe out the vampire race once and for all. In the end the two sides will collide and only one will come out victorious, a battle between the ultimate vampire who never knew defeat, facing off against the greatest vampire slayer."
"Blast from the Past, The",65,"https://imsdb.com/Movie Scripts/Blast from the Past, The Script.html","Adam Weber is the child of an eccentric inventor and his wife. Following a bomb scare in the 1960s that locked the Webers in their bomb shelter for 35 years, Adam Weber must venture out into Los Angeles and obtain food and supplies for his family. He meets Eve, who reluctantly agrees to help him out."
"Blind Side, The",66,"https://imsdb.com/Movie Scripts/Blind Side, The Script.html","Based on the true story of Leigh Anne Tuohy and Sean Tuohy who take in a homeless teenage African-American, Michael Oher. Michael has no idea who his father is and his mother is a drug addict. Michael has had little formal education and few skills to help him learn. Leigh Anne soon takes charge however, as is her nature, ensuring that the young man has every opportunity to succeed. When he expresses an interest in football, she goes all out to help him, including giving the coach a few ideas on how best to use Michael's skills. They not only provide him with a loving home, but hire a tutor to help him improve his grades to the point where he would qualify for an NCAA Division I athletic scholarship. Michael Oher was the first-round pick of the Baltimore Ravens in the 2009 NFL draft."
"Bling Ring, The",67,"https://imsdb.com/Movie Scripts/Bling Ring, The Script.html","Quiet teenager Marc Hall arrives as a new student at Indian Hills High School in Agoura Hills, California. He is befriended by fame-obsessed Rebecca Ahn. While at a party at Rebecca's house, the pair check unlocked vehicles on the street, taking valuables such as cash and credit cards. When Marc mentions that one of his wealthy acquaintances is out of town, Rebecca persuades him to join her in breaking into his house. Rebecca steals a handbag, mentioning that her idol, Lindsay Lohan, has the same one. She also steals cash and the keys to a Porsche, which the pair use to flee the scene. With the cash, the two go on a shopping spree, affording themselves the luxury lifestyle they admire in magazines. Marc visits a nightclub with Rebecca and her friends Nicki Moore, Nicki's adoptive sister Sam, and Chloe Tainer, where they rub shoulders with celebrities such as Kirsten Dunst and Paris Hilton. While researching Hilton on the Internet, Marc and Rebecca realize that she will be out of town. The pair go to her house, and finding the key under the doormat, they go through Hilton's belongings, taking some jewelry. Rebecca then flaunts a stolen bracelet to Nicki, Sam, and Chloe at a party.."
Blood and Wine,68,https://imsdb.com/Movie Scripts/Blood and Wine Script.html,"Writer and Director Bob Rafelson has stated that this is the final part of an informal trilogy he started with Five Easy Pieces (1970) and continued with The King of Marvin Gardens (1972). In the three, Nicholson has now played son, brother, and father. In this one, Nicholson is a wealthy wine dealer who has distanced himself from his wife with his philandering, and from his son with his negligence. After he steals a diamond necklace with the help of a safecracker partner, Victor, things start coming apart. His wife sets out to interrupt what she thinks is another one of his weekend dalliances, but is really his trip to pawn the jewels."
Blood Simple,69,https://imsdb.com/Movie Scripts/Blood Simple Script.html,"Texas bar owner Julian Marty, who is generally regarded as not a nice person, hires shady private detective Loren Visser, who is able to obtain what Marty requests evidence - in this instance, photographic - that his wife, Abby, and one of his bartenders, Ray, are having an affair. As Ray and Abby realize that Marty has found out about them, it allows them to plan for their future away from Marty, while being up front with Marty about the situation. Marty, in turn, decides to hire Visser once again, this time to kill Abby and Ray, and dispose of their bodies so that they won't be found. The out-in-the-open affair and the contract hit lead to some actions based on self-interest and a standoff of sorts between the four players, which is compounded in complexity by some wrong assumptions of what has happened, with an innocent bystander, another of the Marty's bartenders, Meurice, potentially, and unwittingly, adding to the scenario."
Blow,70,https://imsdb.com/Movie Scripts/Blow Script.html,"A boy named George Jung grows up in a struggling family in the 1950's. His mother nags at her husband as he is trying to make a living for the family. It is finally revealed that George's father cannot make a living and the family goes bankrupt. George does not want the same thing to happen to him, and his friend Tuna, in the 1960's, suggests that he deal marijuana. He is a big hit in California in the 1960's, yet he goes to jail, where he finds out about the wonders of cocaine. As a result, when released, he gets rich by bringing cocaine to America. However, he soon pays the price."
Blue Valentine,71,https://imsdb.com/Movie Scripts/Blue Valentine Script.html,"Dean Pereira and Cindy Heller Pereira are a young working-class married couple with a young daughter, Frankie. Dean currently works as a painter and Cindy is a nurse at a medical clinic. Despite their relatively tender ages, they are both ravaged by the life they've eked out together and by the experiences they've had leading into their marriage. High-school dropout Dean comes from a broken home and never really had a mother figure; he never imagined getting married or having a family despite falling in love with Cindy at first sight. He has no professional ambition beyond his current work--which he enjoys since he feels he can down a beer at 8AM and it won't affect his work--although Cindy believes he has so much more potential in life. Cindy also comes from a dysfunctional family; her parents didn't set an example of a harmonious married or family life. One of her previous serious partners, Bobby Ontario, has had a profound effect on many aspects of her marriage to Dean. Dean and Cindy head off on an overnight getaway together without Frankie, seeking a clearer picture of whether their marriage can survive its many issues."
Blue Velvet,72,https://imsdb.com/Movie Scripts/Blue Velvet Script.html,"College student Jeffrey Beaumont returns to his idyllic hometown of Lumberton to manage his father's hardware store while his father is hospitalized. Walking though a grassy meadow near the family home, Jeffrey finds a severed human ear. After an initial investigation, lead police Detective John Williams advises Jeffrey not to speak to anyone about the case as they investigate further. Detective Williams also tells Jeffrey that he cannot divulge any information about what the police know. Detective Williams' high school aged daughter, Sandy Williams, tells Jeffrey what she knows about the case from overhearing her father's private conversations on the matter: that it has to do with a nightclub singer named Dorothy Vallens, who lives in an older apartment building near the Beaumont home. His curiosity getting the better of him, Jeffrey, with Sandy's help, decides to find out more about the woman at the center of the case by breaking into Dorothy's apartment while he knows she's at work. What Jeffrey finds is a world unfamiliar to him, one that he doesn't truly understand but one that he is unable to deny the lure of despite the inherent dangers of being associated with a possible murder. Still, he is torn between this world and the prospect of a relationship with Sandy, the two who are falling for each other, despite Sandy already being in a relationship with Mike, the school's star football player."
"Blues Brothers, The",73,"https://imsdb.com/Movie Scripts/Blues Brothers, The Script.html","After the release of Jake Blues from prison, he and brother Elwood go to visit ""The Penguin"" (Kathleen Freeman), the last of the nuns who raised them in an orphanage. They learn the Archdiocese will stop supporting the school and will sell the place to the Education Authority. The only way to keep the place open is if the $5,000 ($17,868.41 in 2022 adjusted for inflation) tax on the property is paid within 11 days. The Blues Brothers want to help, and decide to put their blues band back together and raise the money by staging a big gig. As they set off on their ""mission from God"" they seem to make more enemies along the way. Will they manage to come up with the money in time?"
"Bodies, Rest & Motion",74,"https://imsdb.com/Movie Scripts/Bodies, Rest %2526 Motion Script.html","Nick is a feckless television salesman who gets fired and impulsively decides that he and his girlfriend, Beth, will move to Butte, MT, which he's read is ""the city of the future."" ""I read that a while ago, so the future should be there by now,"" he enthuses. He waits until the last moment to tell Carol, his ex and Beth's best friend, about the move. While Nick is working his last day, Sid comes to the couple's house to paint it for the next tenants. He quickly develops an interest in Beth. He, Beth, and Carol get stoned and hang out. When Sid hears about the move, he tells Beth that he's never left Enfield, and has no interest in traveling. Meanwhile, Nick decides to take off on his own. When Beth gets word of this from Carol, she finds solace in Sid's arms. Sid proclaims his love the next morning, and implores Beth to stay. Meanwhile, Nick visits his childhood home, looking for his parents, has an epiphany, and decides to return to Carol."
Body Heat,75,https://imsdb.com/Movie Scripts/Body Heat Script.html,Ned Racine is a seedy small town lawyer in Florida. During a searing heatwave he's picked up by married Matty Walker. A passionate affair commences but it isn't long before they realise the only thing standing in their way is Matty's rich husband Edmund. A plot hatches to kill him but will they pull it off?
Body of Evidence,76,https://imsdb.com/Movie Scripts/Body of Evidence Script.html,"A millionaire is found dead of heart failure handcuffed to the bed with a home video tape of him and his lover. When cocaine is found in his system, and his will leaves $8 million to his lover, they arrest her on suspicion of murder. Her lawyer succumbs to her charms, and he begins a torrid and kinky affair with her. As new evidence turns up during trial, he begins to wonder if he's defending a murderer."
Bodyguard,77,https://imsdb.com/Movie Scripts/Bodyguard Script.html,"Bodyguard tells the fictional story of David Budd, a heroic but volatile war veteran now working as a Specialist Protection Officer for the Royalty and Specialist Protection Branch of London's Metropolitan Police Service. When he is assigned to protect the ambitious and powerful Home Secretary Julia Montague, whose politics stand for everything he despises, Budd finds himself torn between his duty and beliefs. Responsible for her safety, is he actually her biggest threat?"
