Movie Title,Unnamed: 0,Movie URL,Synopsis
Frozen (Disney),45,https://imsdb.com/Movie Scripts/Frozen (Disney) Script.html,"Queen Anna has a lot on her plate - there are visitors in her Kingdom, a friend in need, and even the Duke of Weselton's nephew skulking around - so when the Spirits of Nature start acting up, she knows she has to solve the problem - and fast - before things get more out of control. But when Anna and Elsa travel to the Enchanted Forest, they find mysterious copper machines that are disrupting the natural order of things. Who made these machines and what are they doing in the forest? And more importantly, how do Anna and Elsa stop them?"
Frozen River,46,https://imsdb.com/Movie Scripts/Frozen River Script.html,"Takes place in the days before Christmas near a little-known border crossing on the Mohawk reservation between New York State and Quebec. Here, the lure of fast money from smuggling presents a daily challenge to single moms who would otherwise be earning minimum wage. Two women - one white, one Mohawk, both single mothers faced with desperate circumstances - are drawn into the world of border smuggling across the frozen water of the St. Lawrence River. Ray and Lila - and a New York State Trooper as opponent in an evolving cat-and-mouse game."
Fruitvale Station,47,https://imsdb.com/Movie Scripts/Fruitvale Station Script.html,"This is the true story of Oscar, a 22-year-old Bay Area resident who wakes up on the morning of December 31, 2008 and feels something in the air. Not sure what it is, he takes it as a sign to get a head start on his resolutions: being a better son to his mother, whose birthday falls on New Year's Eve, being a better partner to his girlfriend, who he hasn't been completely honest with as of late, and being a better father to T, their beautiful 4 year old daughter. He starts out well, but as the day goes on, he realizes that change is not going to come easy. He crosses paths with friends, family, and strangers, each exchange showing us that there is much more to Oscar than meets the eye. But it would be his final encounter of the day, with police officers at the Fruitvale BART station that would shake the Bay Area to its very core, and cause the entire nation to be witnesses to the story of Oscar Grant."
"Fugitive, The",48,"https://imsdb.com/Movie Scripts/Fugitive, The Script.html","A well respected Chicago surgeon Dr. Richard Kimble has found out that his wife, Helen, has been murdered ferociously in her own home. The police found Kimble and accused him of the murder. Then, Kimble (without Justifiable Reason) was tried, convicted, and sentenced to death. However, on the way to prison, Kimble's transport crashed. Kimble escapes and is now on the run. Deputy Samuel Gerard from Chicago takes charge of the chase of Kimble. Meanwhile, Kimble takes up his own investigation to find who really killed his wife, and to lure Gerard and his team into it as well."
Full Metal Jacket,49,https://imsdb.com/Movie Scripts/Full Metal Jacket Script.html,"A two-segment look at the effect of the military mindset and war itself on Vietnam era Marines. The first half follows a group of recruits in boot camp under the command of the punishing Gunnery Sergeant Hartman. The second half shows one of those recruits, Joker, covering the war as a correspondent for Stars and Stripes, focusing on the Tet offensive."
Funny People,50,https://imsdb.com/Movie Scripts/Funny People Script.html,"George is a very successful stand up comedian who learns that he has an untreatable blood disorder and is given less than a year to live. Ira is a struggling up-and-coming stand up comedian who works at a deli and has yet to figure out his onstage persona. One night, these two perform at the same club and George takes notice of Ira. George hires Ira to be his semi-personal assistant as well as his friend."
Fury,51,https://imsdb.com/Movie Scripts/Fury Script.html,"In April 1945, as the Allies make their final push in the European Theater, a battle-hardened Army sergeant named Wardaddy commands a five-man Sherman tank crew on a deadly mission behind enemy lines. Outnumbered, out-gunned, and with a rookie soldier thrust into their platoon, Wardaddy and his men face overwhelming odds in their heroic attempts to defend a field hospital from Waffen SS troops."
G.I. Jane,0,https://imsdb.com/Movie Scripts/G.I. Jane Script.html,"When a crusading chairperson of the military budget committee pressures the would be Navy secretary to begin full gender integration of the service, he offers the chance for a test case for a female trainee in the US Navy's elite SEAL/C.R.T. selection program. LT. Jordan O'Neill is given the assignment, but no one expects her to succeed in an inhumanly punishing regime that has a standard 60% dropout rate for men. However, O'Neill is determined to prove everyone wrong."
G.I. Joe: The Rise of Cobra,1,https://imsdb.com/Movie Scripts/G.I. Joe: The Rise of Cobra Script.html,"Two soldiers stationed in Kazahkstan (Captain Duke Hauser and his partner ""Ripcord"") are ordered to transport special warheads created by MARS, an arms' manufacturer controlled by James McCullen. When they are attacked by thieves (led by Anastasia DeCobray, with whom Duke has history), they are saved by a top secret, international special forces unit known as ""G.I. Joe"". The leader of G.I. Joe, General Abernathy (or Hawk) is on the trail of the thieves: an evil organization called ""Cobra"". While Duke and Ripcord train to join the Joes, McCullen (""Destro"") is secretly working for Cobra and plotting to recapture his metal-eating ""Nanomite"" warheads. Duke and Ripcord (with help from Heavy Duty, Snake Eyes, and the rest of the Joes) must prove that they are Real American Heroes -- by stopping the launch of these warheads before Cobra uses them to take over the world."
Game 6,2,https://imsdb.com/Movie Scripts/Game 6 Script.html,"Nicky Rogan's new play is opening on Broadway and many agree, he has written the best play of his career. Or has he? Critic Steven Schwimmer is slated to review and he's ruined many a playwright with his scathing words. Nicky is becoming concerned, but instead chooses to obsess over his Red Sox and their chances against the Mets in Game 6 of the 1986 World Series. Will the Sox and his play come crashing down on the same night?"
"Game, The",3,"https://imsdb.com/Movie Scripts/Game, The Script.html","Nicholas Van Orton is a very wealthy San Francisco banker, but he is an absolute loner, even spending his birthday alone. In the year of his 48th birthday (the age his father committed suicide) his brother Conrad, who has gone long ago and surrendered to addictions of all kinds, suddenly returns and gives Nicholas a card giving him entry to unusual entertainment provided by something called Consumer Recreation Services (CRS). Giving in to curiosity, Nicholas visits CRS and all kinds of weird and bad things start to happen to him."
Gamer,4,https://imsdb.com/Movie Scripts/Gamer Script.html,"Ken Castle is extremely rich, popular, and powerful since he invented and started exploiting the virtual online parallel reality games. In these games, people can either pay to be a user or get paid to be an 'actor' in a system of mind-control. In the ultimate version, Slayers, death row convicts act as gladiators in a desperate dim bid for survival, which no one has achieved yet. The champion, John 'Kable' Tillman, is scheduled to die just before he'd gain release, but he persuades his teenage 'handler' to hand over the reins so he can fully use his talents and experience. Kable escapes to freedom, but Castle's men chase him. Kable has to fight his way back to Castle's headquarters to challenge his hidden evil plans."
Gandhi,5,https://imsdb.com/Movie Scripts/Gandhi Script.html,"In 1893, Mohandas K. Gandhi is thrown off a South African train for being an Indian and traveling in a first class compartment. Gandhi realizes that the laws are biased against Indians and decides to start a non-violent protest campaign for the rights of all Indians in South Africa. After numerous arrests and the unwanted attention of the world, the government finally relents by recognizing rights for Indians, though not for the native blacks of South Africa. After this victory, Gandhi is invited back to India, where he is now considered something of a national hero. He is urged to take up the fight for India's independence from the British Empire. Gandhi agrees, and mounts a non-violent non-cooperation campaign of unprecedented scale, coordinating millions of Indians nationwide. There are some setbacks, such as violence against the protesters and Gandhi's occasional imprisonment. Nevertheless, the campaign generates great attention, and Britain faces intense public pressure. Too weak from World War II to continue enforcing its will in India, Britain finally grants India's independence. Indians celebrate this victory, but their troubles are far from over. Religious tensions between Hindus and Muslims erupt into nation-wide violence. Gandhi declares a hunger strike, saying he will not eat until the fighting stops. The fighting does stop eventually, but the country is divided. It is decided that the northwest area of India, and eastern part of India (current day Bangladesh), both places where Muslims are in the majority, will become a new country called Pakistan (West and East Pakistan respectively). It is hoped that by encouraging the Muslims to live in a separate country, violence will abate. Gandhi is opposed to the idea, and is even willing to allow Muhammad Ali Jinnah to become the first prime minister of India, but the Partition of India is carried out nevertheless. Gandhi spends his last days trying to bring about peace between both nations. He thereby angers many dissidents on both sides, one of whom finally gets close enough to assassinate him."
Gang Related,6,https://imsdb.com/Movie Scripts/Gang Related Script.html,"Two corrupt cops murder an undercover DEA agent by mistake, and frantically try to cover their tracks by framing a homeless man for the crime. That involves juggling evidence, coaching witnesses, and improvising to keep their desperate scheme from unraveling."
Gangs of New York,7,https://imsdb.com/Movie Scripts/Gangs of New York Script.html,"In the god-forsaken district of early-1860s Lower Manhattan known as the Five Points, the vicious Nativist, Bill ""The Butcher"" Cutting, is the supreme overlord of an area riddled with crime, prostitution, theft and murder, as the American Civil War still rages on. Sixteen whole years after the brutal murder of his father from Bill's blood-stained hands, an orphaned Irish-American, Amsterdam Vallon, returns to this melting pot of corruption to avenge his untimely death; however, a lot has changed since then. Who can remember the once-innocent boy and now a young man bent on revenge, who works his way up to the hierarchy of Five Points? Will Amsterdam ever taste the dangerous but sweet fruit of retribution?"
Garden State,8,https://imsdb.com/Movie Scripts/Garden State Script.html,"Andrew Largeman is a semi-successful television actor who plays an intellectually disabled quarterback. His somewhat controlling and psychiatrist father has led Andrew (""Large"") to believe that his mother's wheelchair-bound life was his fault. Andrew decides to lay off the drugs that his father and his doctor made him believe that he needed, and began to see life for what it is. He began to feel the pain he had longed for, and began to have a genuine relationship with a girl who had some problems of her own."
Gattaca,9,https://imsdb.com/Movie Scripts/Gattaca Script.html,"In the not-too-distant future, a less-than-perfect man wants to travel to the stars. Society has categorized Vincent Freeman as less than suitable given his genetic make-up and he has become one of the underclass of humans that are only useful for menial jobs. To move ahead, he assumes the identity of Jerome Morrow, a perfect genetic specimen who is a paraplegic as a result of a car accident. With professional advice, Vincent learns to deceive DNA and urine sample testing. Just when he is finally scheduled for a space mission, his program director is killed and the police begin an investigation, jeopardizing his secret."
Get Carter,10,https://imsdb.com/Movie Scripts/Get Carter Script.html,"Years ago, Jack Carter left his Seattle home to become a Las Vegas mob casino financial enforcer. He returns for the funeral of his brother Richard ""Richie"" after a car crash during a storm, atypical of the careful house-father. Talking to the widow, daughter Doreen, and enigmatic Geraldine, Jack suspects it was murder. Cliff Brumby, whose club Richie ran, is financially linked to porn and prostitution baron Cyrus Paice, who claims to be just a front-man for ITC tycoon Jeremy Kinnear. Someone hired goon Thorpey to make Jack return to Las Vegas. Jack's partner Con McCarty is restless, apparently about their boss Les Fletcher, whose wife had an affair with Jack. Someone breaks into Richie's home, looking for a crucial CD."
Get Low,11,https://imsdb.com/Movie Scripts/Get Low Script.html,"Felix Bush (Robert Duvall) is a hermit who has no regard for anybody in the town or anyone who wants to get to know him. But one day, after a fellow old hermit has died and he hears people in the town telling stories about him, he decides that he needs to get these stories out in the public. He recruits Frank (Bill Murray), the local funeral home director, to host his own funeral. This way he can hear what everyone is saying about him, and get the truth to his past out in the open. But will he be able to get anybody to come? And will he be able to reveal his secrets?"
Get on Up,12,https://imsdb.com/Movie Scripts/Get on Up Script.html,"On route to the stage, singer James Brown recalls a life with a turbulent childhood where music was his only constructive release for his passions. A chance demonstration of that in prison led to a new friend who helped get him out and into a musical career. With his fire and creative daring, Brown became a star who defiantly created new possibilities in show business both on and behind the stage in face of racism and conventional thinking. Along the way, James would also become a peacemaker who redefined and raised the African-American community's feeling of self-worth when it was needed most. However, those same domineering passions would lead James Brown alienating everyone around him as his appetites became ever more self-destructive. Only after he hit rock bottom with a serious mistake does Brown realize what he needs to do make his life as the Godfather of Soul truly worthwhile."
Get Out,13,https://imsdb.com/Movie Scripts/Get Out Script.html,"Chris and his girlfriend Rose go upstate to visit her parents for the weekend. At first, Chris reads the family's overly accommodating behavior as nervous attempts to deal with their daughter's interracial relationship, but as the weekend progresses, a series of increasingly disturbing discoveries lead him to a truth that he never could have imagined."
Get Shorty,14,https://imsdb.com/Movie Scripts/Get Shorty Script.html,"Some guys get all the luck, whether they like it or not. Chili Palmer happens to be in Hollywood collecting a gambling debt when he's struck by lightning (not literally). Called a natural for the movie business, he's snagged up by a producer. The rest is history."
"Getaway, The",15,"https://imsdb.com/Movie Scripts/Getaway, The Script.html","Carter ""Doc"" McCoy is a career robber, currently in his fourth year of a 10-year prison sentence at the Texas State Penitentiary. After his request for parole is denied although he's a model prisoner, Doc, unable emotionally to endure life inside, asks his loving wife Carol McCoy to contact crooked businessman Jack Beynon, a man with political connections, to secure his release in return for being ""for sale"" to Beynon. Beynon is able to get Doc released, the sale price being for Doc to plan and execute a robbery at a small bank branch in Beacon City, Texas where Beynon knows that $750,000 will be kept in the vault for the next two weeks. Rather than Doc using his own men for the job, Beynon directs that the only other people involved will be the men of his own choosing, Rudy and Frank. There are to be no casualties, which is all right with Doc who is not a murderer. After the robbery is completed and the monies divvied up accordingly, Doc and Carol will cross the border into Mexico to live out their lives away from capture. The robbery doesn't go according to Doc's plan, and Doc and Carol go on the run making their way into Mexico with their share of the loot. Various people are in their pursuit, some who know that they will try to cross into Mexico at one of the two major West Texas border crossings. Other bystanders get directly or indirectly involved in the proceedings; two of those people, seeming straight-laced couple Fran and Harold Clinton, get much more intimately involved than the others. Though it all, Doc and Carol must work through some of their own issues, which arise out of a revelation about Doc's release from prison."
Ghost,16,https://imsdb.com/Movie Scripts/Ghost Script.html,"Even though Sam Wheat, the successful investment counsellor, still finds it difficult to express his deeper feelings for her after all these years, his young potter girlfriend, Molly Jensen, is the love of his life. However, a curious case of a systematic discrepancy will prepare the ground for a hideous urban homicide in one of Manhattan's dark alleys, trapping, seemingly forever, the unfortunate deceased's immortal soul in the realm of the mortals. With the condemned spirit unable to interact with the physical world--and as Molly's life, too, is in grave danger--Sam will have to turn to the spiritual medium, Oda Mae Brown, to warn and protect her. Can Oda and the ghost settle the unfinished business in time?"
"Ghost and the Darkness, The",17,"https://imsdb.com/Movie Scripts/Ghost and the Darkness, The Script.html","Sir Robert Beaumont is behind schedule on a railroad in Africa. Enlisting noted engineer John Henry Patterson to right the ship, Beaumont expects results. Everything seems great until the crew discovers the mutilated corpse of the project's foreman, seemingly killed by a lion. After several more attacks, Patterson calls in famed hunter Charles Remington, who has finally met his match in the bloodthirsty lions."
Ghost Rider,18,https://imsdb.com/Movie Scripts/Ghost Rider Script.html,"When the motorcyclist Johnny Blaze finds that his father Barton Blaze has terminal cancer, he accepts a pact with Mephistopheles, giving his soul for the health of his beloved father. But the devil deceives him, and Barton dies in a motorcycle accident during an exhibition. Johnny leaves the carnival, his town, his friends, and his girlfriend Roxanne. Many years later, Johnny Blaze becomes a famous motorcyclist, who risks his life in his shows, and he meets Roxanne again, now a television reporter. However, Mephistopheles proposes Johnny to release his contract if he become the ""Ghost Rider"" and defeat his evil son Blackheart, who wants to possess one thousand evil souls and transform hell on Earth."
Ghost Ship,19,https://imsdb.com/Movie Scripts/Ghost Ship Script.html,"In a remote region of the Bering Sea, a boat salvage crew discovers the eerie remains of a grand passenger liner thought lost for more than 40 years. Once on-board, the crew must confront the ship's horrific past and face the ultimate fight for their lives."
Ghost World,20,https://imsdb.com/Movie Scripts/Ghost World Script.html,"Best friends Enid and Rebecca have just graduated from high school, although Enid has to take a summer school art class, which she failed during the regular school year, to graduate officially. Their plan since seventh grade has been not to go to college, but rather move in together after graduating, which now entails them getting jobs to pay for that independence. As Enid is constantly drawing things which she witnesses in her day-to-day life in her notebook for her own pleasure, that art class failing grade is only one demonstration of the contempt both Enid and Rebecca have for anything that is mainstream, which includes the structure of school and most of their classmates. Their ""people"", as Enid confirms, are the freaks, sickos and weirdos of society. Just for fun, they decide to respond to an ""I Saw You"" personal ad to see what loser placed the ad, who, he believes in attending the date, would be stood up by the woman for who he is looking. He is forty-something Seymour, who would admit that he beats to his own drummer and too cannot tolerate being with people who he just doesn't understand. Although Enid does not admit to Seymour that she and Rebecca were the ones that answered the ad, Enid becomes his friend based on their shared sensibilities. As Enid and Rebecca move on to the post-graduation phase of their lives, Enid slowly begins to alienate all around her, including Rebecca and possibly Seymour as she subversively begins to direct things in his life to thwart anything that is remotely mainstream. Enid believes that life as she knows it will be all right as long as she has one touchstone which to return, that touchstone which may not be as permanent as she believes."
Ghostbusters,21,https://imsdb.com/Movie Scripts/Ghostbusters Script.html,"Peter Venkman, Ray Stantz and Egon Spengler work at Columbia University. where they delve into the paranormal and fiddle with many unethical experiments on their students. As they are kicked out of the University, they really understand the paranormal and go into business for themselves. Under the new snazzy business name of 'Ghostbusters', and living in the old firehouse building they work out of, they are called to rid New York City of paranormal phenomenon at everyone's whim. - for a price. They make national press as the media reports the Ghostbusters are the cause of it all. Thrown in jail by the EPA, the mayor takes a chance and calls on them to help save the city. Unbeknownst to all, a long dead Gozer worshiper (Evo Shandor) erected a downtown apartment building which is the cause of all the paranormal activity. They find out the building could resurrect the ancient Hittite god, Gozer, and bring an end to all of humanity. Who are you gonna call to stop this terrible world-ending menace?"
Ghostbusters 2,22,https://imsdb.com/Movie Scripts/Ghostbusters 2 Script.html,"Having lost their status and credibility five years after covering New York City with gooey roasted marshmallows in Ghostbusters (1984), the city's former heroes and once-popular spirit-hunters struggle to keep afloat, forced to work odd jobs. However, when Dana and her baby have yet another terrifying encounter with the paranormal, it is up to Peter Venkman and his fearless team of supernatural crime fighters to step up and save the day. Once more, humankind is in danger, as rivers of slimy psycho-reactive ectoplasm, paired with the dreadful manifestation of evil sixteenth-century tyrant Vigo the Carpathian, threaten to plunge the entire city into darkness. Is the world ready to believe? Can the Ghostbusters save us for the second time?"
Ginger Snaps,23,https://imsdb.com/Movie Scripts/Ginger Snaps Script.html,"Is becoming a woman analogous, in some deep psychological way, to becoming a werewolf? Ginger is 15, edgy, tough, and, with her younger sister, into staging and photographing scenes of death. They've made a pact about dying together. In early October, on the night she has her first period, which is also the night of a full moon, a werewolf bites Ginger. Within a few days, some serious changes happen to her body and her temperament. Her sister Brigitte, 15, tries to find a cure with the help of Sam, a local doper. As Brigitte races against the clock, Halloween and another full moon approach, Ginger gets scarier, and it isn't just local dogs that begin to die."
"Girl with the Dragon Tattoo, The",24,"https://imsdb.com/Movie Scripts/Girl with the Dragon Tattoo, The Script.html","Mikael Blomkvist is a disgraced journalist who is asked by a wealthy industrialist to write a biography on his family. But what he really wants Blomkvist to do is to find out what happened to his niece, who went missing 40 years ago. At first Blomkvist isn't interested, until the man offers to help him clear his name. Blomkvist begins by talking to the man's relatives who were there when the girl went missing, but some of them are not forthcoming. Blomkvist eventually believes that her disappearance might have something to do with some serial killings that took place 20 years before she disappeared, so he asks for a research assistant. The industrialist's man suggests Lisbeth Salander, a talented hacker who does background checks for them and who even did one on Blomkvist. When he sees her report, he's impressed and asks her to work with him and she does. She's anti-social but is extremely efficient."
Gladiator,25,https://imsdb.com/Movie Scripts/Gladiator Script.html,"Maximus is a powerful Roman general, loved by the people and the aging Emperor, Marcus Aurelius. Before his death, the Emperor chooses Maximus to be his heir over his own son, Commodus, and a power struggle leaves Maximus and his family condemned to death. The powerful general is unable to save his family, and his loss of will allows him to get captured and put into the Gladiator games until he dies. The only desire that fuels him now is the chance to rise to the top so that he will be able to look into the eyes of the man who will feel his revenge."
