Movie Title,Unnamed: 0,Movie URL,Synopsis
A Few Good Men,0,https://imsdb.com/Movie Scripts/A Few Good Men Script.html,"In this dramatic courtroom thriller, Lieutenant Junior Grade Daniel Kaffee, a Navy lawyer who has never seen the inside of the courtroom, defends two stubborn Marines who have been accused of murdering a colleague. Kaffee is known as being lazy and had arranged for a plea bargain. Downey's Aunt Ginny appoints Lieutenant Commander Galloway to represent him. Also on the legal staff is LTJG Sam Weinberg. The team rounds up many facts and Kaffee is discovering that he is really cut out for trial work. The defense is originally based upon the fact that PFC Santiago, the victim, was given a ""CODE RED"". Santiago was basically a screw-up. At Gitmo, screw-ups aren't tolerated. Especially by Col. Nathan Jessup. In Cuba, Jessup and two senior officers try to give all the help they can, but Kaffee knows something's fishy. In the conclusion of the film, the fireworks are set off by a confrontation between Jessup and Kaffee."
A Most Violent Year,1,https://imsdb.com/Movie Scripts/A Most Violent Year Script.html,"A crime drama set in New York City during the winter of 1981--statistically one of the most violent years in the city's history--and centered on the lives of an immigrant and his family trying to expand their business and capitalize on opportunities as the rampant violence, decay, and corruption of the day drag them in and threaten to destroy all they have built."
A Prayer Before Dawn,2,https://imsdb.com/Movie Scripts/A Prayer Before Dawn Script.html,"Billy Moore, an English boxer, down on his luck, addicted to Ya Ba, and stuck in Thailand, ends up getting arrested and sent to Nakhon Pathom Prison outside of Bangkok, where he struggles to survive and eventually ends up fighting in Muay Tai boxing tournaments."
A Quiet Place,3,https://imsdb.com/Movie Scripts/A Quiet Place Script.html,
A Scanner Darkly,4,https://imsdb.com/Movie Scripts/A Scanner Darkly Script.html,"In a totalitarian society in a near future, the undercover detective Bob Arctor is working with a small time group of drug users trying to reach the big distributors of a brain-damaging drug called Substance D. His assignment is promoted by the recovery center New Path Corporation, and when Bob begins to lose his own identity and have schizophrenic behavior, he is submitted to tests to check his mental conditions."
A Serious Man,5,https://imsdb.com/Movie Scripts/A Serious Man Script.html,"Bloomington, Minnesota, 1967: Jewish physics lecturer Larry Gopnik is a serious and a very put-upon man. His daughter is stealing from him to save up for a nose job; his pot-head son, who gets stoned at his own bar-mitzvah, only wants him round to fix the TV aerial and his useless brother Arthur is an unwelcome houseguest. But both Arthur and Larry get turfed out to a motel when Larry's wife Judy, who wants a divorce, moves her lover Sy into the house and even after Sy's death in a car crash they are still there. With lawyers' bills mounting for his divorce, Arthur's criminal court appearances, and a land feud with a neighbor, Larry is tempted to take the bribe offered by a student to give him an illegal exam pass mark. And the rabbis he visits for advice only dole out platitudes. Still God moves in mysterious--and not always pleasant--ways, as Larry and his family will find out."
A.I.,6,https://imsdb.com/Movie Scripts/A.I. Script.html,"In the not-so-far future the polar ice caps have melted and the resulting rise of the ocean waters has drowned all the coastal cities of the world. Withdrawn to the interior of the continents, the human race keeps advancing, reaching the point of creating realistic robots (called mechas) to serve them. One of the mecha-producing companies builds David, an artificial kid which is the first to have real feelings, especially a never-ending love for his ""mother"", Monica. Monica is the woman who adopted him as a substitute for her real son, who remains in cryo-stasis, stricken by an incurable disease. David is living happily with Monica and her husband, but when their real son returns home after a cure is discovered, his life changes dramatically."
Above the Law,7,https://imsdb.com/Movie Scripts/Above the Law Script.html,"Nico Toscani, a former CIA agent, Aikido expert, and hard-as-nails Chicago police sergeant, has sniffed out the nefarious activities of crooked FBI operatives while investigating an international drug ring. However, when the suspects are allowed to walk away scot-free, Toscani finds himself with his back to the wall, putting his friends, colleagues, and family in harm's way. Now, a frenzied race against the clock to stop a psychotic drug lord and thwart a sinister political assassination plot begins. But no one is above the law. Who can stand in the way of justice and incorruptible Nico, Chicago's finest?"
Absolute Power,8,https://imsdb.com/Movie Scripts/Absolute Power Script.html,"Inspired by David Baldacci's novel, and the ruthlessness of people in power. President Alan Richmond believes that everything he does is beyond reproach, including an affair or two. That leads to murder and everyone around him is involved. There is only one witness, a thief named Luther Whitney. They are sure he'll talk, but when? The Secret Service is determined to keep him quiet, but catching a thief isn't always easy."
"Abyss, The",9,"https://imsdb.com/Movie Scripts/Abyss, The Script.html","Formerly married petroleum engineers who still have some issues to work out. They are drafted to assist a gung-ho Navy SEAL with a top-secret recovery operation: a nuclear sub has been ambushed and sunk, under mysterious circumstances, in some of the deepest waters on Earth."
Ace Ventura: Pet Detective,10,https://imsdb.com/Movie Scripts/Ace Ventura: Pet Detective Script.html,"To be a Pet Detective, you have to understand both the criminals and animals. Ace Ventura goes even further... He behaves like a criminal animal. When a football team's mascot (a dolphin) is stolen just before the Superbowl, Ace Ventura is put on the case. Now, who would want to steal a dolphin, and why?"
Adaptation,11,https://imsdb.com/Movie Scripts/Adaptation Script.html,"While his latest movie Being John Malkovich (1999) is in production, screenwriter Charlie Kaufman is hired by Valerie Thomas to adapt Susan Orlean's non-fiction book ""The Orchid Thief"" for the screen. Thomas bought the movie rights before Orlean wrote the book, when it was only an article in The New Yorker. The book details the story of rare orchid hunter John Laroche, whose passion for orchids and horticulture made Orlean discover passion and beauty for the first time in her life. Charlie wants to be faithful to the book in his adaptation, but despite Laroche himself being an interesting character in his own right, Charlie is having difficulty finding enough material in Laroche to fill a movie, while equally not having enough to say cinematically about the beauty of orchids. At the same time, Charlie is going through other issues in his life. His insecurity as a person doesn't allow him to act upon his feelings for Amelia Kavan, who is interested in him as a man. And Charlie's twin brother, pretentious Donald, has moved into his house with a goal of also becoming a screenwriter. Despite not admiring Donald as a screenwriter, Charlie asks for his advice. Together, they feel that there is some interesting subtext in the book on which Orlean herself can only elaborate, if only Charlie has the nerve to talk to her. If she can't or won't elaborate, they may have to find out the meaning of that subtext on their own."
"Addams Family, The",12,"https://imsdb.com/Movie Scripts/Addams Family, The Script.html",The Addams Family steps out of Charles Addams' cartoons. They live with all of the trappings of the macabre (including a detached hand for a servant) and are quite wealthy. Added to this mix is a crooked accountant and his loan shark and a plot to slip the shark's son into the family as their long-lost Uncle Fester. Can the false Fester find his way into the vault before he is discovered?
"Adjustment Bureau, The",13,"https://imsdb.com/Movie Scripts/Adjustment Bureau, The Script.html","Do we control our destiny, or do unseen forces manipulate us? A man glimpses the future Fate has planned for him and realizes he wants something else. To get it, he must pursue across, under and through the streets of modern-day New York the only woman he's ever loved. On the brink of winning a seat in the U.S. Senate, ambitious politician David Norris (Matt Damon) meets beautiful contemporary ballet dancer Elise Sellas (Emily Blunt), a woman like none he's ever known. But just as he realizes he's falling for her, mysterious men conspire to keep the two apart. David learns he is up against the agents of Fate itself, the men of The Adjustment Bureau, who will do everything in their considerable power to prevent David and Elise from being together. In the face of overwhelming odds, he must either let her go and accept a predetermined path... or risk everything to defy Fate and be with her."
"Adventures of Buckaroo Banzai Across the Eighth Dimension, The",14,"https://imsdb.com/Movie Scripts/Adventures of Buckaroo Banzai Across the Eighth Dimension, The Script.html","Brain surgeon, rock musician, adventurer Buckaroo Banzai is a modern renaissance man and has made scientific history. He perfected the Oscillation Overthruster, which allows him to travel through solid matter by using the eighth dimension. But when his sworn enemy Dr. Emilio Lizardo devises a plot to steal the device and bring an evil army back to destroy Earth, Buckaroo goes cranium to cranium with the madman in a battle that could spell doom for the universe. Along with his crime-fighting team, the Hong Kong Cavaliers, Buckaroo must stop the evil alien invaders from the eighth dimension who are planning to conquer our dimension. He is helped by Penny Pretty, the long-lost twin sister of his late wife, and some good extra-dimensional beings who look and talk like they are from Jamaica."
Affliction,15,https://imsdb.com/Movie Scripts/Affliction Script.html,"Boston University professor Whitehouse tells of the events leading up to the disappearance of his older brother Wade. The police officer who investigates is deeply troubled, and the murder case drains his mental acuity to the point of a total mental collapse."
After School Special,16,https://imsdb.com/Movie Scripts/After School Special Script.html,
After.Life,17,https://imsdb.com/Movie Scripts/After.Life Script.html,"Running out of options and money, single mum Callie sets foot in the small town of Summerville, Oklahoma, with her two teenage children, Phoebe and Trevor. And now, there is no turning back. As the family attempts to settle in the dilapidated house of Callie's eccentric late father, unexpected secrets hidden in plain sight, mysterious equipment, and a strange vehicle rotting in the barn seem to relate to the area's puzzling seismic activity, and something even more shocking: the long-forgotten Stay-Puft Marshmallow Man Incident in 1980s New York City. But there hasn't been a single ghost sighting since the bizarre events of Ghostbusters II (1989). Is history repeating itself? Will Phoebe connect the dots, give her grandfather a voice, and discover the family's connection to the original Ghostbusters (1984)?"
Agnes of God,18,https://imsdb.com/Movie Scripts/Agnes of God Script.html,"When a dead newborn is found wrapped in bloody sheets in a wastebasket in the bedroom of a young novitiate, psychiatrist Martha Livingston is called in to determine if the seemingly innocent novice, who knows nothing of sex or birth, is competent to stand trial for the baby's murder. While searching for the answer that her supervisors want, Dr. Livingston finds herself inevitably drawn into searching for the truth about the baby's conception and death. Despite the lack of cooperation that she receives from her own organization and the church itself, she eventually discovers more than she may have bargained for."
Air Force One,19,https://imsdb.com/Movie Scripts/Air Force One Script.html,"The President of the USA goes to Moscow and gives a stirring speech outlining the USA's new ""Zero-tolerance"" policy with respect to terrorism. On the flight home, terrorists take over Air Force One (the President's official plane) and take the passengers (including his wife and daughter) hostage. The terrorists plan to execute one hostage every half-hour unless/until their demands are met. However, the President is a former Medal of Honor winner, so the terrorists may be in for a surprise..."
Airplane,20,https://imsdb.com/Movie Scripts/Airplane Script.html,"Drowning his sorrows after that botched mission during World War II, Ted Striker, a traumatized ex-fighter-pilot with a neurotic fear of flying, still has not gotten over his old flame, flight attendant, Elaine Dickinson. Determined to win her back, Ted boards a domestic flight from Los Angeles to Chicago, only to come face-to-face with a severe case of in-flight food poisoning that is threatening everyone's lives. With most of the passengers and the entire cockpit crew down with the food-borne illness, Striker must confront his inner demons and take over the control of the ungovernable aircraft with the help of a gruff air-traffic controller and his former commander. Can Ted Striker land the airplane and save the passengers?"
Airplane 2: The Sequel,21,https://imsdb.com/Movie Scripts/Airplane 2: The Sequel Script.html,"Still haunted by that fateful wartime incident and the nearly catastrophic events of Airplane! (1980), Ted Striker, the ex-fighter pilot who hates flying, escapes from the mental asylum. But as the first passenger space shuttle, the state-of-the-art but untested Mayflower One, is about to take off on its maiden flight, once more, an unforeseen malfunction forces Ted to take over the controls of the shuttle. Now, the traumatized commander is holding everyone's lives in his hands, and as if that weren't enough, Striker has to patch up his already complicated relationship with his engaged former lover, Elaine Dickinson, and confront an unhinged voyager bent on destruction. Can Ted Striker, the reluctant hero, save the day for the second time?"
Aladdin,22,https://imsdb.com/Movie Scripts/Aladdin Script.html,"Kind-hearted street urchin Aladdin vies for the love of beautiful Princess Jasmine of Agrabah. When he finds a magic lamp, he uses the genie's magic power to make himself a prince in order to marry her. He's also on a mission to stop the powerful Jafar, who plots to steal the magic lamp that could make his deepest wishes come true."
Ali,23,https://imsdb.com/Movie Scripts/Ali Script.html,"In 1964, a brash new pro boxer, fresh from his Olympic gold medal victory, explodes on to the scene, Cassius Clay. Bold and outspoken, he cuts an entirely new image for African Americans in sport with his proud public self confidence with his unapologetic belief that he is the greatest boxer of all time. To his credit, he sets out to prove that with his highly agile and forceful style soon making him a formidable boxer who soon claims the heavyweight championship. His personal life is no less noteworthy with his allegiance to the Nation of Islam, his friendship with the controversial Malcolm X and his abandonment of his slave name in favor of Muhammad Ali stirring up controversy. Yet, at the top of his game, both Ali's personal and professional lives face the ultimate test with the military draft rules are changed, making him eligible for military induction during the Vietnam War. Despite the fact that he could easily agree to a sweetheart deal that would have meant an easy tour of duty for himself, Ali refuses to submit on principle to cooperate in an unjust war for a racist nation that treated his people so poorly. The cost of that stand is high as he finds himself unable to legally box in his own country while his case is contested in court. What follows is a battle for a man who would sacrifice so much for what he believes in and a comeback that would cement his legend as one of the great sports figures of all time."
Alien,24,https://imsdb.com/Movie Scripts/Alien Script.html,"In the distant future, the crew of the commercial spaceship ""Nostromo"" is on its way home when the crew picks up a distress call from a distant moon. The crew is under obligation to investigate and the spaceship descends on the small planetoid afterward. After a rough landing, three crew members leave the spaceship to explore the area on the planetoid. At the same time as the crew discovers a hive colony of some unknown creature, the ship's computer deciphers the message to be a warning, not a distress call. When one of the eggs is disturbed, the crew realizes that it is not alone on the spaceship and it must deal with the consequences."
Alien 3,25,https://imsdb.com/Movie Scripts/Alien 3 Script.html,
Alien Nation,26,https://imsdb.com/Movie Scripts/Alien Nation Script.html,"A few years from now, Earth will have the first contact with an alien civilisation. These aliens, known as Newcomers, slowly begin to be integrated into human society after years of quarantine but are victims of a new type of discrimination. When the first Newcomer police officer, Sam Francisco is assigned his new partner, he is given Matthew Sykes , a mildly racist veteran, the animosity between them soon gives way to respect as they investigate the Newcomer underworld, and especially Newcomer leader William Harcourt."
Alien vs. Predator,27,https://imsdb.com/Movie Scripts/Alien vs. Predator Script.html,"When a private satellite encounters an unidentified source of heat in Antarctica and it is found to be a pyramid buried deep underground , a search team comprising of top-of-the-line archaeologists and engineers is sent to Antarctica to find out more . Once there , the team comes across signs which indicate that the place is inhabited by an unknown alien species . It is not long before the aliens begin to hunt the team members . At the same time , a trio of coming-of-age Predators have arrived to collect the skulls of the aliens as trophies , and the humans are caught between a deadly battle between the two warring species ."
Alien: Resurrection,28,https://imsdb.com/Movie Scripts/Alien: Resurrection Script.html,"The saga continues 200 years after Ripley sacrificed herself for the sake of humanity. Her erstwhile employers long gone, this time it is the military that resurrects the one-woman killing machine through genetic cloning to extract the alien from within her, but during the process her DNA is fused with the queen and then the aliens escape. Now Ripley must decide where her allegiance lies."
Aliens,29,https://imsdb.com/Movie Scripts/Aliens Script.html,"57 years after Ellen Ripley had a close encounter with the reptilian alien creature from the first movie, she is called back, this time, to help a group of highly trained colonial marines fight off against the sinister extraterrestrials. But this time, the aliens have taken over a space colony on the moon LV-426. When the colonial marines are called upon to search the deserted space colony, they later find out that they are up against more than what they bargained for. Using specially modified machine guns and enough firepower, it's either fight or die as the space marines battle against the aliens. As the Marines do their best to defend themselves, Ripley must attempt to protect a young girl who is the sole survivor of the nearly wiped out space colony."
All About Eve,30,https://imsdb.com/Movie Scripts/All About Eve Script.html,"Eve Harrington (Anne Baxter) is waiting backstage to meet her idol, talented but aging Broadway star Margo Channing (Bette Davis). It seems innocent enough as Eve explains that she has seen Margo in EVERY performance of her current play. Margo and her friends take Eve under their wing but only theatre critic Addison DeWitt (George Sanders) sees through Eve's evil plan, which is to take Margo's parts and her fiancé, Bill Simpson (Gary Merrill) too."
All About Steve,31,https://imsdb.com/Movie Scripts/All About Steve Script.html,"Mary Horowitz writes crossword puzzles for the Sacramento Herald. She's loquacious to a fault. When kids at a Career Day make fun of her for being single, she accepts a blind date with Steve, the cameraman for a CNN-like news network. Within minutes she decides he's the man for her. Quickly put off by her constant verbiage and over-the-top advances, he makes an off-hand remark about going on the road with her, then splits. Moonstruck, she writes a sappy crossword puzzle, loses her job, and decides to follow him as the news team crisscrosses the Southwest; Steve's team eggs her on. Then she falls into a mine shaft, and she and Steve become a story. It a love story?"
All the King's Men,32,https://imsdb.com/Movie Scripts/All the King's Men Script.html,"Jack Burden is a newspaper reporter who first hears of Willie Stark when his editor sends him to Kanoma County to cover the man. What's special about this nobody running for county treasurer? He's supposedly an honest man. Burden discovers this to be true when he sees Stark delivering a speech and having his son pass out handbills, while the local politicians do their best to intimidate him. Willie Stark is honest and brave. He's also a know-nothing hick whose schoolteacher wife has given him what little education he has. Stark loses the race for treasurer, but later makes his way through law school, becoming an idealistic attorney who fights for what is good. Someone in the governor's employ remembers Stark when the governor needs a patsy to run against him and split the vote of his rival. The fat cats underestimate Stark; but Jack Burden, Stark's biggest supporter, overestimates the man's idealism. To get where he wants to go, Willie Stark is willing to crack a few eggs - which include his tough-talking assistant, Sadie Burke; Jack's poised and elegant fiancée, Anne Stanton; and even Jack Burden himself."
All the President's Men,33,https://imsdb.com/Movie Scripts/All the President's Men Script.html,"In the run-up to the 1972 elections, Washington Post reporter Bob Woodward covers what seems to be a minor break-in at the Democratic Party National headquarters. He is surprised to find top lawyers already on the defense case, and the discovery of names and addresses of White House fund organizers on the accused further arouses his suspicions. The editor of the Post is prepared to run with the story and assigns Woodward and Carl Bernstein to it. They find the trail leading higher and higher in the White House."
Almost Famous,34,https://imsdb.com/Movie Scripts/Almost Famous Script.html,"The early 1970s. William Miller is 15-years old and an aspiring rock journalist. He gets a job writing for Rolling Stone magazine. His first assignment: tour with the band Stillwater and write about the experience. Miller will get to see what goes on behind the scenes in a famous band, including the moments when things fall apart, and for him, it will be a period of new experiences and finding himself."
Alone in the Dark,35,https://imsdb.com/Movie Scripts/Alone in the Dark Script.html,"Edward Carnby, detective of the paranormal, unexplained and supernatural, investigates a mystery (the recent death of a friend) with clues leading to ""Shadow Island"" that brings him face to face with bizarre horrors that prove both psychologically disturbing and lethal, as he discovers that evil demons worshiped by an ancient culture called the Abskani are planning on coming back to life in the 21st century to once again take over the world... and only he and a young genius anthropologist with an incredible memory (and his ex-girlfriend), Aline Cedrac, stand in their way, at a gateway to hell. Standing in Carnby's way, however, is the impact that a brief encounter with an evil spirit called the Queen had upon his mind, as he slowly finds himself overpowered by the forces of darkness as they eat away at his very sanity..."
Amadeus,36,https://imsdb.com/Movie Scripts/Amadeus Script.html,"Antonio Salieri believes that Wolfgang Amadeus Mozart's music is divine and miraculous. He wishes he was himself as good a musician as Mozart so that he can praise the Lord through composing. He began his career as a devout man who believes his success and talent as a composer are God's rewards for his piety. He's also content as the respected, financially well-off, court composer of Austrian Emperor Joseph II. But he's shocked to learn that Mozart is such a vulgar creature, and can't understand why God favored Mozart to be his instrument. Salieri's envy has made him an enemy of God whose greatness was evident in Mozart. He is ready to take revenge against God and Mozart for his own musical mediocrity."
Amelia,37,https://imsdb.com/Movie Scripts/Amelia Script.html,"Amelia Earhart, a Kansas girl, discovers the thrill of aviation at age 23, and within 12 years has progressed to winning the Distinguished Flying Cross for being the first woman to pilot a plane solo across the Atlantic Ocean. At age 39, she sets out on an attempt to circumnavigate the globe, an adventure that catapults her into aviation myth."
